<?xml version="1.0" encoding="UTF-8"?>
<list xmlns:xsi="http://www.w3.org/2001/XMLSchema-instance" xsi:noNamespaceSchemaLocation="../../../xsd/spawn.xsd">
	<spawn count="1" respawn="60" respawn_random="0" period_of_day="none"> 
	<debug name="territory_name" val="15_25 [point-001]" />
		<point x="-149649" y="255028" z="-80" h="16384" />
		<npc id="32614" /><!--Lamcedas-->
	</spawn>
	<spawn count="1" respawn="60" respawn_random="0" period_of_day="none"> 
	<debug name="territory_name" val="15_25 [point-002]" />
		<point x="-148656" y="253841" z="-184" h="24576" />
		<npc id="32616" /><!--Mine-->
	</spawn>
	<spawn count="1" respawn="60" respawn_random="0" period_of_day="none"> 
	<debug name="territory_name" val="15_25 [point-003]" />
		<point x="-149360" y="252936" z="-136" h="16384" />
		<npc id="32609" /><!--Airship Controller-->
	</spawn>
	<spawn count="1" respawn="60" respawn_random="0" period_of_day="none">
	<debug name="territory_name" val="15_25 [point-004]" />
		<point x="-149484" y="253680" z="-184" h="16384" />
		<npc id="32564" /><!--Papiku-->
	</spawn>
	<spawn count="1" respawn="60" respawn_random="0" period_of_day="none">
	<debug name="territory_name" val="15_25 [point-005]" />
		<point x="-149235" y="253680" z="-184" h="16384" />
		<npc id="32565" /><!--Felix-->
	</spawn>
	<spawn count="1" respawn="60" respawn_random="0" period_of_day="none">
	<debug name="territory_name" val="15_25 [point-006]" />
		<point x="-149067" y="255028" z="-80" h="23225" />
		<npc id="32615" /><!--Ishuma-->
	</spawn>
	<spawn count="1" respawn="60" respawn_random="0" period_of_day="none">
	<debug name="territory_name" val="15_25 [point-007]" />
		<point x="-148777" y="254544" z="-186" h="37690" />
		<npc id="32628" /><!--Wharf Patrol-->
	</spawn>
	<spawn count="1" respawn="60" respawn_random="0" period_of_day="none">
	<debug name="territory_name" val="15_25 [point-008]" />
		<point x="-148804" y="254521" z="-187" h="42005" />
		<npc id="32628" /><!--Wharf Patrol-->
	</spawn>
	<spawn count="1" respawn="60" respawn_random="0" period_of_day="none"> 
	<debug name="territory_name" val="15_25 [point-009]" />
		<point x="-149929" y="254543" z="-187" h="50030" />
		<npc id="32629" /><!--Wharf Patrol-->
	</spawn>
	<spawn count="1" respawn="60" respawn_random="0" period_of_day="none"> 
	<debug name="territory_name" val="15_25 [point-010]" />
		<point x="-149909" y="254506" z="-187" h="28583" />
		<npc id="32629" /><!--Wharf Patrol-->
	</spawn>
</list>